text,joy,trust,fear,surprise,sadness,disgust,anger,anticipation,love,worried,disappointed,proud,embarrassed,jealous,calm,excited
Ở hiền gặp lành.,1,1,0,0,0,0,0,1,1,0,0,0,1,0,1,1
Ngoài đời mà vậy chắc chắn sẽ loạn mất.,0,0,1,0,0,0,0,0,0,1,0,0,0,0,0,0
Phim hay,1,1,0,0,0,0,0,1,0,0,0,0,0,0,1,1
Phim rất hay nam và nữ chính rất đẹp đôi.,1,1,0,0,0,0,0,1,1,0,0,0,0,0,1,1
Đúng là ác giả ác báo mà gieo nhân nào gặp quả ấy.,0,1,0,0,0,0,0,1,0,0,0,1,0,0,1,0
Cả bệnh viện mà không có nổi một người để tiểu tam làm càn vậy trời.,0,0,0,0,0,0,1,1,0,0,1,0,0,0,0,0
Đây là cái kết tuyệt vời cho hai mẹ con nữ chính.,1,1,0,0,0,0,0,1,1,0,0,0,0,0,1,1
Người cha bắt vợ nuôi con tiểu tam là không thể chấp nhận.,0,0,0,0,0,0,1,1,0,0,1,0,0,0,0,0
Nghe giọng thuyết minh mắc mệt.,0,0,0,0,0,0,0,0,0,0,1,1,0,0,0,0
Mẹ quá hiền hậu.,0,1,0,0,0,0,0,0,1,0,0,0,0,0,1,0
Chồng mu muội nghe trà xanh rồi không có kết đẹp đâu,0,0,0,0,0,0,1,1,0,0,1,0,0,0,0,0
Vì ơn nghĩa trả giá quá đắt người đàn ông này bỏ cũng không oan cảm ơn kênh.,0,1,0,0,0,0,0,0,1,0,0,1,0,0,0,0
Thật hay càng nghe càng hấp dẫn.,1,1,0,0,0,0,0,1,1,0,0,0,0,0,1,1
Đáng đời cho cha con bay lắm.,0,0,0,0,0,0,1,1,0,0,0,0,0,0,0,0
Đứa con vậy uổng công mang nặng đẻ đau.,0,0,0,0,1,1,1,0,0,0,1,0,0,0,0,0
Nữ chính mạnh mẽ dứt khoát quá OK tìm được hạnh phúc tuyệt vời.,1,1,0,0,0,0,0,1,1,0,0,1,0,0,1,1
Đứa con gái thật bất hiếu.,0,0,0,0,0,0,1,1,0,0,0,1,0,0,0,0
Sao bỏ con trời tội nghiệp bé.,0,0,0,0,1,1,0,0,0,0,1,0,0,0,0,0
Hoan hô ly dị rồi.,1,0,0,1,0,0,0,1,0,0,0,1,0,0,0,1
Chồng vô lương tâm thì bỏ ngay.,0,0,0,0,0,0,1,1,0,0,0,1,0,0,0,0
Dì già trơ trẽn quá à,0,0,0,0,0,0,1,1,0,0,0,0,0,0,0,0
Phim hay tuyệt vời nữ chính rất mạnh mẽ.,1,1,0,0,0,0,0,1,1,0,0,1,0,0,1,1
Thằng chồng quá khốn nạn vợ đẹp con ngoan không biết trân trọng.,0,0,0,0,0,0,1,1,0,0,0,1,0,0,0,0
Tiểu tam quá độc ác.,0,0,0,0,0,0,1,1,0,0,0,0,0,0,0,0
Phim chi lạ vậy trời.,0,0,0,1,0,0,0,0,0,0,1,1,0,0,0,0
Thằng chồng cặn bã nhưng đứa con gái thật hồ đồ.,0,0,0,0,0,0,1,1,0,0,0,1,0,0,0,0
Chồng tồi thì bỏ ngay.,0,0,0,0,0,0,1,1,0,0,0,0,0,0,0,0
Phim xem nhàm chán quá.,0,0,0,0,1,0,0,0,0,0,1,1,0,0,0,0
Muốn đập vào mặt con trà xanh đó.,0,0,0,0,0,0,1,1,0,0,0,0,0,0,1,0
Quá trơ trẽn làm hư trẻ con.,0,0,0,0,0,0,1,1,0,0,0,0,0,0,0,0
Nữ chính xấu thế.,0,0,0,0,0,0,1,0,0,0,1,0,0,0,1,0
Trẻ con bạc bẽo.,0,0,0,0,1,1,0,0,0,0,1,0,0,0,0,0
Người mẹ đau lòng nhất khi con gọi tiểu tam là mẹ.,0,0,0,0,1,1,0,0,0,0,1,0,0,0,0,0
Nữ chính thông minh rút lui khỏi nơi bẩn thỉu này.,1,1,0,0,0,0,0,1,1,0,0,1,0,0,1,1
Đàn ông thay lòng đổi dạ chẳng khác gì quả dưa.,0,0,0,0,0,0,1,1,0,0,0,1,0,0,0,0
Đúng là thằng chồng không biết nhục.,0,0,0,0,0,0,1,1,0,0,0,1,0,0,0,0
"Phim hay lồng tiếng vừa hài hước, nữ chính quá tuyệt vời.",1,1,0,0,0,0,0,1,1,0,0,0,0,0,0,1
"Trời ơi nhỏ cháu gái cưng quá, nam nữ chính đẹp đôi.",1,1,0,0,0,0,0,1,1,0,0,0,0,0,0,1
"Phim hay, con bé dễ thương lắm luôn.",1,1,0,0,0,0,0,0,1,0,0,0,0,0,1,0
Phim nữ chính nam chính đẹp xuất sắc.,1,1,0,0,0,0,0,1,1,0,0,1,0,0,0,1
Phim hay quá nam chính nữ chính đẹp đôi dễ thương.,1,1,0,0,0,0,0,1,1,0,0,0,0,0,1,1
Con gái thật dễ thương đáng yêu.,1,1,0,0,0,0,0,0,1,0,0,0,0,0,1,0
Phim hay diễn viên đẹp diễn xuất xuất sắc.,1,1,0,0,0,0,0,1,1,0,0,1,0,0,0,1
"Phim nữ chính hài rất vui, xem cười bể bụng luôn.",1,1,0,1,0,0,0,1,1,0,0,0,0,0,0,1
"Phim hay dễ thương lắm, em bé cũng dễ thương.",1,1,0,0,0,0,0,0,1,0,0,0,0,0,1,0
Cặp đôi dễ thương kết có hậu.,1,1,0,0,0,0,0,1,1,0,0,0,0,0,1,1
Phim rất hay kết thúc đẹp diễn viên chính xuất sắc.,1,1,0,0,0,0,0,1,1,0,0,1,0,0,1,1
Thuyết minh hay quá phim càng thấy hay.,1,1,0,0,0,0,0,0,1,0,0,0,0,0,1,0
Giọng thuyết minh thật đáng yêu.,1,1,0,0,0,0,0,0,1,0,0,0,0,0,1,0
Phim hay diễn viên đẹp và khá hài hước.,1,1,0,0,0,0,0,1,1,0,0,0,0,0,1,1
Bé con quá đáng yêu.,1,1,0,0,0,0,0,0,1,0,0,0,0,0,1,0
Phim vừa hay vừa hài.,1,1,0,0,0,0,0,1,1,0,0,0,0,0,1,1
Phim hay cặp đôi đẹp thích quá.,1,1,0,0,0,0,0,1,1,0,0,0,0,0,1,1
Phim hay nam nữ chính đẹp đôi mẹ chồng dễ thương em bé đáng yêu.,1,1,0,0,0,0,0,1,1,0,0,0,0,0,1,1
Phim lôi cuốn vui hài.,1,1,0,0,0,0,0,1,1,0,0,0,0,0,1,1
Phim hay kết thúc có hậu.,1,1,0,0,0,0,0,1,1,0,0,0,0,0,1,1
Gì vậy má phim mà tổng tài nhuộm tóc trắng bộ muốn bạc đầu à.,0,0,0,1,0,0,0,0,0,0,0,0,0,0,0,0
Lồng tiếng không đúng nội dung ai cũng dùng chữ anh làm không có thiện cảm.,0,0,0,0,0,1,1,0,0,0,1,0,0,0,0,0
Phim ok nhưng thuyết minh xem để xưng hô cho đúng.,0,0,0,0,0,0,0,0,0,0,1,0,0,0,1,0
Trời ơi dịch gì kỳ quá mất hứng.,0,0,0,1,1,0,1,0,0,0,1,0,0,0,0,0
Phim hay diễn viên đẹp nhưng thuyết minh lộn xộn.,1,0,0,0,0,0,0,0,1,0,1,0,0,0,0,0
Mai mốt bạn đừng dịch nữa nghe thấy ghét quá.,0,0,0,0,0,1,1,0,0,0,1,0,0,0,0,0
Diễn biến phim hơi dài thuyết minh rối nhưng coi giải trí được.,0,1,0,0,0,0,0,0,0,0,0,0,0,0,1,0
Phim hay nhưng thuyết minh xưng hô loạn xạ.,0,0,0,0,0,0,1,0,0,0,1,0,0,0,0,0
Phim hay nữ chính mạnh mẽ xem mới vui.,1,1,0,0,0,0,0,1,1,0,0,0,1,0,0,1
Cái kết hay lắm bọn phản bội bị quả báo.,1,1,0,0,0,0,0,1,1,0,0,0,1,0,0,1
Phim hay cách hành xử của nữ chính đã quá.,1,1,0,0,0,0,0,1,1,0,0,0,1,0,0,1
Phim hay nữ chính mạnh mẽ dứt khoát đúng ý.,1,1,0,0,0,0,0,1,1,0,0,0,1,0,0,1
Nam chính đẹp trai dễ thương quá chừng.,1,1,0,0,0,0,0,0,1,0,0,0,0,0,0,1
Nữ chính đẹp quá vóc dáng tuyệt vời.,1,1,0,0,0,0,0,0,1,0,0,0,0,0,0,1
Phim hay nhưng thuyết minh lộn xộn tùm lum.,0,0,0,0,0,1,1,0,0,0,1,0,0,0,0,0
Hay trả thù quá nữ chính dứt khoát.,1,1,0,0,0,0,0,1,1,0,0,0,1,0,0,1
Nhân quả công bằng cái kết thật đẹp.,1,1,0,0,0,0,0,1,1,0,0,0,1,0,1,1
Phim hay thích nữ chính mạnh mẽ.,1,1,0,0,0,0,0,1,1,0,0,0,1,0,0,1
Phim hay nhưng phiên dịch chán quá.,0,0,0,0,0,1,1,0,0,0,1,0,0,0,0,0
Phim hay quá diễn viên chính có tình cảm.,1,1,0,0,0,0,0,1,1,0,0,0,0,0,1,1
Phim hay nữ chính đẹp gái mạnh mẽ tuyệt vời.,1,1,0,0,0,0,0,1,1,0,0,1,0,0,0,1
Phim xem khoái thật diễn xuất rất xuất sắc.,1,1,0,1,0,0,0,1,0,0,0,0,0,0,0,1
Phim này kết thúc rất hay ác giả ác báo.,1,1,0,0,0,0,0,1,0,0,0,0,0,0,1,0
Film quá hay xem rất đã cảm ơn chủ kênh.,1,1,0,0,0,0,0,0,1,0,0,0,0,0,1,1
Tần Tống đẹp trai quá phim hay.,1,1,0,0,0,0,0,0,1,0,0,0,0,0,0,1
Tôi cũng muốn mình thông minh và mạnh mẽ như nữ chính.,1,1,0,0,0,0,0,1,0,0,0,1,0,0,0,1
Kết thúc chắc rất có hậu rất cảm ơn.,1,1,0,0,0,0,0,1,0,0,0,0,0,0,1,0
Phim rất hay người phụ nữ đánh tiểu tam tuyệt vời.,1,1,0,0,0,0,0,1,1,0,0,1,0,0,0,1
Phim hay thích xem phụ nữ mạnh mẽ như vậy.,1,1,0,0,0,0,0,1,1,0,0,0,0,0,0,1
Giờ mới xem được bộ phim hay và cái kết tuyệt vời.,1,1,0,1,0,0,0,1,0,0,0,0,0,0,0,1
Bộ phim hay nhiều tình tiết hấp dẫn.,1,1,0,1,0,0,0,1,0,0,0,0,0,0,1,0
Phim hay quá lâu rồi mới được xem toàn tập như thế này.,1,1,0,1,0,0,0,1,0,0,0,0,0,0,1,1
Nam chính diễn xuất rất tốt.,1,1,0,0,0,0,0,0,0,0,0,1,0,0,1,0
Nữ chính đóng quá hay quá mạnh mẽ xuất sắc.,1,1,0,1,0,0,0,1,1,0,0,1,0,0,0,1
Cuối cùng cũng thành cặp đôi trai tài gái sắc.,1,1,0,1,0,0,0,1,1,0,0,0,0,0,0,1
Phim hay quá,1,1,0,0,0,0,0,0,0,0,0,0,0,0,1,1
Xem mà thấy mát lòng mát dạ.,1,1,0,0,0,0,0,1,0,0,0,0,0,0,1,1
Phim hay diễn viên chính xinh đẹp.,1,1,0,0,0,0,0,0,1,0,0,0,0,0,1,1
Phim hay đầy tính nhân văn thiện ác rõ ràng.,1,1,0,0,0,0,0,1,0,0,0,0,1,0,1,0
Phim rất hay nữ chính rất dũng cảm.,1,1,0,0,0,0,0,1,1,0,0,1,0,0,0,1
Phim hay nữ chính rất mạnh mẽ.,1,1,0,0,0,0,0,1,1,0,0,1,0,0,0,1
Xem phim mà thấy đã quá cảm ơn đạo diễn.,1,1,0,1,0,0,0,1,0,0,0,0,0,0,1,1
Phim hay diễn viên trẻ đẹp.,1,1,0,0,0,0,0,0,1,0,0,0,0,0,1,1
Phim này hay quá cảm ơn.,1,1,0,0,0,0,0,0,1,0,0,0,0,0,1,1
Phim thật hay cảm ơn tác giả.,1,1,0,0,0,0,0,0,1,0,0,0,0,0,1,1
Tần tổng vừa đẹp vừa hài.,1,1,0,1,0,0,0,0,1,0,0,0,0,0,0,1
Yêu nữ chính quá thích nữ chính ăn miếng trả miếng.,1,1,0,1,0,0,0,1,1,0,0,1,0,0,0,1
Dan bà phải như nữ chính này mới được.,1,1,0,0,0,0,0,1,1,0,0,1,0,0,0,1
Phim rất hay người đến sau sẽ hạnh phúc.,1,1,0,0,0,0,0,1,1,0,0,0,0,0,1,0
Tuyệt vời lắm diễn hay lắm.,1,1,0,1,0,0,0,0,1,0,0,1,0,0,0,1
Nhân quả nhãn tiền là đây,1,1,0,0,0,0,0,1,0,0,0,0,1,0,1,0
Phim hay kết thật thích đáng.,1,1,0,0,0,0,0,1,1,0,0,0,0,0,1,1
Vào phim thấy nữ chính rất dễ thương và mạnh mẽ.,1,1,0,0,0,0,0,1,1,0,0,1,0,0,1,1
Phim hay tình cảm diễn viên xinh đẹp kết có hậu.,1,1,0,0,0,0,0,1,1,0,0,0,0,0,1,1
Phim hay,1,1,0,0,0,0,0,0,0,0,0,0,0,0,1,1
Phim rất hay,1,1,0,0,0,0,0,0,0,0,0,0,0,0,1,1
Phim hay nữ 9 mạnh mẽ thích.,1,1,0,0,0,0,0,1,1,0,0,1,0,0,1,1
Phim hay cảm ơn,1,1,0,0,0,0,0,0,1,0,0,0,0,0,1,1
Phim hay đỉnh của chóp.,1,1,0,0,0,0,0,1,0,0,0,0,0,0,1,1
Phim rất hay có hậu.,1,1,0,0,0,0,0,1,1,0,0,0,0,0,1,1
Phim hay nội dung rất có ý nghĩa.,1,1,0,0,0,0,0,1,0,0,0,0,1,0,1,0
Phim xem đã nư.,1,1,0,1,0,0,0,1,0,0,0,0,0,0,1,1
Phim hay diễn viên trẻ đẹp.,1,1,0,0,0,0,0,0,1,0,0,0,0,0,1,1
Phim này hay thật.,1,1,0,0,0,0,0,0,0,0,0,0,0,0,1,1
Phim hay đáng đời cho kẻ lăng nhăng.,1,1,0,0,0,0,0,1,0,0,0,0,0,0,1,0
Nam chính đẹp trai ghê nữ chính đẹp.,1,1,0,0,0,0,0,0,1,0,0,0,0,0,1,1
Phim hay rất có hậu.,1,1,0,0,0,0,0,1,1,0,0,0,0,0,1,1
Phim hay nín thở lâu rồi xem rất cuốn.,1,1,0,1,0,0,0,1,1,0,0,0,0,0,0,1
Phim rất hay kết thúc có hậu.,1,1,0,0,0,0,0,1,1,0,0,0,0,0,1,1
Phim quá hay luôn.,1,1,0,0,0,0,0,0,1,0,0,0,0,0,1,1
Phim rất hay cảm ơn bạn đã chia sẻ.,1,1,0,0,0,0,0,0,1,0,0,0,0,0,1,1
Phim hay võ thuật rất tuyệt.,1,1,0,0,0,0,0,1,0,0,0,1,0,0,1,1
Phim hay rất có hậu.,1,1,0,0,0,0,0,1,1,0,0,0,0,0,1,1
Phim rất hay nữ chính mạnh mẽ xuất sắc.,1,1,0,0,0,0,0,1,1,0,0,1,0,0,0,1
Phim hay nội dung hấp dẫn.,1,1,0,1,0,0,0,1,0,0,0,0,0,0,1,1
Phim xem đã mắt ghê.,1,1,0,1,0,0,0,1,0,0,0,0,0,0,1,1
Phim quá hay tuyệt vời.,1,1,0,0,0,0,0,0,1,0,0,0,0,0,1,1
Phim hay cảm ơn đạo diễn.,1,1,0,0,0,0,0,0,1,0,0,0,0,0,1,1
Phim hay rất có ý nghĩa.,1,1,0,0,0,0,0,1,1,0,0,0,1,0,1,0
Phim hay đỉnh của chóp.,1,1,0,0,0,0,0,1,0,0,0,0,0,0,1,1
Phim hay quá hồi hộp.,1,1,0,1,0,0,0,1,0,0,0,0,0,0,1,1
Phim hay xem rất thích.,1,1,0,0,0,0,0,0,1,0,0,0,0,0,1,1
